{
  "schema_version": "kolosseum.registry_seal_manifest.v1",
  "manifest_id": "launch_registry_surface",
  "manifest_version": "1.0.0",
  "seal_scope": "registry_bundle",
  "entries": [
    {
      "path": "registries/activity/activity.registry.json"
    },
    {
      "path": "registries/exercise/exercise.registry.json"
    },
    {
      "path": "registries/exercise/exercise_substitution_graph.json"
    },
    {
      "path": "registries/exercise/exercise_warmup_mapping.registry.json"
    },
    {
      "path": "registries/movement/movement.registry.json"
    },
    {
      "path": "registries/program/program.registry.json"
    },
    {
      "path": "registries/equipment/equipment.registry.json"
    },
    {
      "path": "registries/sport_subdivision/sport_subdivision.registry.json"
    }
  ]
}
